bert-tuning.stage2.log
{"input": ["cuda -keys=cuda,gpu -max_num_threads=1024 -model=t4 -thread_warp_size=32", "batch_matmul.cuda", [["TENSOR", [12, 14, 64], "float32"], ["TENSOR", [12, 14, 64], "float32"]], {}], "config": {"index": 4233, "code_hash": null, "entity": [["tile_y", "sp", [-1, 14, 1]], ["tile_x", "sp", [-1, 7, 1]], ["tile_k", "sp", [-1, 8]], ["auto_unroll_max_step", "ot", 64], ["unroll_explicit", "ot", 1]]}, "result": [[3.057599004900113e-06], 0, 1.372239589691162, 1600071883.5608485], "version": 0.2, "tvm_version": "0.7.dev1"}
{"input": ["cuda -keys=cuda,gpu -max_num_threads=1024 -model=t4 -thread_warp_size=32", "batch_matmul.cuda", [["TENSOR", [12, 14, 14], "float32"], ["TENSOR", [12, 64, 14], "float32"]], {}], "config": {"index": 7932, "code_hash": null, "entity": [["tile_y", "sp", [-1, 14, 1]], ["tile_x", "sp", [-1, 1, 4]], ["tile_k", "sp", [-1, 14]], ["auto_unroll_max_step", "ot", 64], ["unroll_explicit", "ot", 1]]}, "result": [[3.009705098842816e-06], 0, 1.7311642169952393, 1600071899.9756315], "version": 0.2, "tvm_version": "0.7.dev1"}
{"input": ["cuda -keys=cuda,gpu -max_num_threads=1024 -model=t4 -thread_warp_size=32", "batch_matmul.cuda", [["TENSOR", [1, 14, 768], "float32"], ["TENSOR", [1, 2304, 768], "float32"]], {}], "config": {"index": 162915, "code_hash": null, "entity": [["tile_y", "sp", [-1, 1, 7]], ["tile_x", "sp", [-1, 32, 1]], ["tile_k", "sp", [-1, 128]], ["auto_unroll_max_step", "ot", 64], ["unroll_explicit", "ot", 0]]}, "result": [[8.809147294938917e-05], 0, 1.3616304397583008, 1600073495.1877239], "version": 0.2, "tvm_version": "0.7.dev1"}
