bert-tuning.stage1.log
{"input": ["cuda -keys=cuda,gpu -max_num_threads=1024 -model=t4 -thread_warp_size=32", "dense_small_batch.cuda", [["TENSOR", [1, 768], "float32"], ["TENSOR", [768, 768], "float32"], null, "float32"], {}], "config": {"index": 9, "code_hash": null, "entity": [["tile_k", "sp", [-1, 32]]]}, "result": [[4.091775950312369e-06], 0, 1.6598443984985352, 1600069031.4703436], "version": 0.2, "tvm_version": "0.7.dev1"}
{"input": ["cuda -keys=cuda,gpu -max_num_threads=1024 -model=t4 -thread_warp_size=32", "batch_matmul.cuda", [["TENSOR", [12, 14, 64], "float32"], ["TENSOR", [12, 14, 64], "float32"]], {}], "config": {"index": 750, "code_hash": null, "entity": [["tile_y", "sp", [-1, 14, 1]], ["tile_x", "sp", [-1, 7, 1]], ["tile_k", "sp", [-1, 4]], ["auto_unroll_max_step", "ot", 16], ["unroll_explicit", "ot", 0]]}, "result": [[3.004984687174376e-06], 0, 1.4446308612823486, 1600073238.543839], "version": 0.2, "tvm_version": "0.7.dev1"}
{"input": ["cuda -keys=cuda,gpu -max_num_threads=1024 -model=t4 -thread_warp_size=32", "batch_matmul.cuda", [["TENSOR", [12, 14, 14], "float32"], ["TENSOR", [12, 64, 14], "float32"]], {}], "config": {"index": 1803, "code_hash": null, "entity": [["tile_y", "sp", [-1, 14, 1]], ["tile_x", "sp", [-1, 16, 1]], ["tile_k", "sp", [-1, 14]], ["auto_unroll_max_step", "ot", 16], ["unroll_explicit", "ot", 0]]}, "result": [[2.992662872929836e-06], 0, 1.2974038124084473, 1600082179.2956343], "version": 0.2, "tvm_version": "0.7.dev1"}
{"input": ["cuda -keys=cuda,gpu -max_num_threads=1024 -model=t4 -thread_warp_size=32", "batch_matmul.cuda", [["TENSOR", [1, 14, 768], "float32"], ["TENSOR", [1, 768, 768], "float32"]], {}], "config": {"index": 9781, "code_hash": null, "entity": [["tile_y", "sp", [-1, 2, 7]], ["tile_x", "sp", [-1, 12, 1]], ["tile_k", "sp", [-1, 24]], ["auto_unroll_max_step", "ot", 8], ["unroll_explicit", "ot", 0]]}, "result": [[2.3166848052074225e-05], 0, 1.678410530090332, 1600082224.2483861], "version": 0.2, "tvm_version": "0.7.dev1"}
{"input": ["cuda -keys=cuda,gpu -max_num_threads=1024 -model=t4 -thread_warp_size=32", "batch_matmul.cuda", [["TENSOR", [1, 14, 768], "float32"], ["TENSOR", [1, 3072, 768], "float32"]], {}], "config": {"index": 14344, "code_hash": null, "entity": [["tile_y", "sp", [-1, 2, 7]], ["tile_x", "sp", [-1, 32, 1]], ["tile_k", "sp", [-1, 24]], ["auto_unroll_max_step", "ot", 8], ["unroll_explicit", "ot", 0]]}, "result": [[7.039479091310102e-05], 0, 1.4073750972747803, 1600082273.0364268], "version": 0.2, "tvm_version": "0.7.dev1"}
{"input": ["cuda -keys=cuda,gpu -max_num_threads=1024 -model=t4 -thread_warp_size=32", "batch_matmul.cuda", [["TENSOR", [1, 14, 3072], "float32"], ["TENSOR", [1, 768, 3072], "float32"]], {}], "config": {"index": 172591, "code_hash": null, "entity": [["tile_y", "sp", [-1, 2, 7]], ["tile_x", "sp", [-1, 12, 1]], ["tile_k", "sp", [-1, 48]], ["auto_unroll_max_step", "ot", 32], ["unroll_explicit", "ot", 1]]}, "result": [[0.00011411962322946175], 0, 1.1853978633880615, 1600082342.5345936], "version": 0.2, "tvm_version": "0.7.dev1"}
