bert-tuning.full.log
{"input": ["cuda -keys=cuda,gpu -max_num_threads=1024 -model=t4 -thread_warp_size=32", "dense_small_batch.cuda", [["TENSOR", [1, 768], "float32"], ["TENSOR", [768, 768], "float32"], null, "float32"], {}], "config": {"index": 9, "code_hash": null, "entity": [["tile_k", "sp", [-1, 32]]]}, "result": [[4.217684123055163e-06], 0, 1.5294814109802246, 1600071926.6396472], "version": 0.2, "tvm_version": "0.7.dev1"}
{"input": ["cuda -keys=cuda,gpu -max_num_threads=1024 -model=t4 -thread_warp_size=32", "batch_matmul.cuda", [["TENSOR", [1, 14, 768], "float32"], ["TENSOR", [1, 2304, 768], "float32"]], {}], "config": {"index": 335833, "code_hash": null, "entity": [["tile_y", "sp", [-1, 2, 7]], ["tile_x", "sp", [-1, 4, 3]], ["tile_k", "sp", [-1, 96]], ["auto_unroll_max_step", "ot", 64], ["unroll_explicit", "ot", 1]]}, "result": [[0.00013859921547933158], 0, 1.5344312191009521, 1600071949.6415732], "version": 0.2, "tvm_version": "0.7.dev1"}
{"input": ["cuda -keys=cuda,gpu -max_num_threads=1024 -model=t4 -thread_warp_size=32", "batch_matmul.cuda", [["TENSOR", [12, 14, 14], "float32"], ["TENSOR", [12, 64, 14], "float32"]], {}], "config": {"index": 3794, "code_hash": null, "entity": [["tile_y", "sp", [-1, 7, 2]], ["tile_x", "sp", [-1, 2, 1]], ["tile_k", "sp", [-1, 14]], ["auto_unroll_max_step", "ot", 64], ["unroll_explicit", "ot", 0]]}, "result": [[3.005877362797918e-06], 0, 1.3542325496673584, 1600072027.9773827], "version": 0.2, "tvm_version": "0.7.dev1"}
{"input": ["cuda -keys=cuda,gpu -max_num_threads=1024 -model=t4 -thread_warp_size=32", "batch_matmul.cuda", [["TENSOR", [1, 14, 768], "float32"], ["TENSOR", [1, 768, 768], "float32"]], {}], "config": {"index": 125216, "code_hash": null, "entity": [["tile_y", "sp", [-1, 1, 14]], ["tile_x", "sp", [-1, 16, 1]], ["tile_k", "sp", [-1, 128]], ["auto_unroll_max_step", "ot", 16], ["unroll_explicit", "ot", 1]]}, "result": [[3.766846022457694e-05], 0, 1.7261853218078613, 1600072038.4479718], "version": 0.2, "tvm_version": "0.7.dev1"}
{"input": ["cuda -keys=cuda,gpu -max_num_threads=1024 -model=t4 -thread_warp_size=32", "batch_matmul.cuda", [["TENSOR", [1, 14, 768], "float32"], ["TENSOR", [1, 3072, 768], "float32"]], {}], "config": {"index": 214808, "code_hash": null, "entity": [["tile_y", "sp", [-1, 7, 2]], ["tile_x", "sp", [-1, 2, 16]], ["tile_k", "sp", [-1, 96]], ["auto_unroll_max_step", "ot", 32], ["unroll_explicit", "ot", 1]]}, "result": [[0.00016088984189325275], 0, 1.4210426807403564, 1600072067.6705573], "version": 0.2, "tvm_version": "0.7.dev1"}
{"input": ["cuda -keys=cuda,gpu -max_num_threads=1024 -model=t4 -thread_warp_size=32", "batch_matmul.cuda", [["TENSOR", [12, 14, 64], "float32"], ["TENSOR", [12, 14, 64], "float32"]], {}], "config": {"index": 2658, "code_hash": null, "entity": [["tile_y", "sp", [-1, 14, 1]], ["tile_x", "sp", [-1, 2, 7]], ["tile_k", "sp", [-1, 16]], ["auto_unroll_max_step", "ot", 8], ["unroll_explicit", "ot", 1]]}, "result": [[3.760742837213358e-06], 0, 1.4623525142669678, 1600073655.8144915], "version": 0.2, "tvm_version": "0.7.dev1"}
{"input": ["cuda -keys=cuda,gpu -max_num_threads=1024 -model=t4 -thread_warp_size=32", "batch_matmul.cuda", [["TENSOR", [1, 14, 3072], "float32"], ["TENSOR", [1, 768, 3072], "float32"]], {}], "config": {"index": 108354, "code_hash": null, "entity": [["tile_y", "sp", [-1, 14, 1]], ["tile_x", "sp", [-1, 12, 2]], ["tile_k", "sp", [-1, 2]], ["auto_unroll_max_step", "ot", 8], ["unroll_explicit", "ot", 1]]}, "result": [[0.0002842884458715596], 0, 1.286597728729248, 1600073752.7729588], "version": 0.2, "tvm_version": "0.7.dev1"}
